question,answer,question_type
Cinlerin yaratılışları hakkında Kuran'da nasıl bir bilgi verilir ve bu bilginin kesinliği hakkında ne söyleyebiliriz?,"Kuran'da cinlerin ateşten yaratıldığı belirtilir (""Allah insanı pişmiş bir çamurdan yarattı. Cinni de halis bir ateşten (mâric bir nardan) yarattı."" Rahman Suresi, 55/14-15). Ancak,  'halis ateş' veya 'ateşin özü' olarak tercüme edilebilen 'min mâricin min nâr' ifadesinin tam anlamı bilinmediğinden, cinlerin ateşle olan irtibatları hakkında kesin bir hüküm vermek mümkün değildir.  Yine de cinlerin 'nâr'dan yaratıldığı kesindir.",Factual
Cinler ve insanlar arasındaki temel yaratılış farkı nedir ve bu farkın insan ve cinlerin özelliklerine etkisi nasıl yorumlanabilir?,"Kuran'a göre insanlar pişmiş çamurdan, cinler ise ateşten yaratılmıştır. Bu temel fark,  insanların maddesel yapısının toprakla olan benzerliğine işaret ederken, cinlerin ateşle olan bağlantısına işaret eder.  Bu yaratılış farkının, cin ve insanların fiziksel ve belki de ruhsal özelliklerini nasıl etkilediği metinde açıkça belirtilmese de,  insanların maddesel dünyaya daha bağlı, cinlerin ise daha farklı bir varoluş biçimine sahip olabileceği yorumu yapılabilir.",Analytical
Kur'an'a göre cinler ve insanlar nasıl yaratılmışlardır ve ne için sorumludurlar?,"Kur'an'a göre, hem cinler hem de insanlar Allah'a kulluk etsinler diye yaratılmışlardır (Zariyat, 51/56).  İlahi mesajlar almaları nedeniyle, emir ve yasaklara karşı sorumludurlar.",Factual
Cinlerin gaybı bilmemeleri ile ilgili olarak Sebe Suresi'nde anlatılan olay bize neyi göstermektedir?,"Sebe Suresi'nde anlatılan Hz. Süleyman'ın ölümünün cinler tarafından fark edilmemesi, onların gaybı bilmediklerini göstermektedir. Eğer bilselerdi, kendilerini küçük düşüren bir azap içinde kalmazlardı.",Analytical
Kur'an'a göre İblis'in cinlerden olduğunu gösteren kanıtlar nelerdir?,"Kur'an'da İblis'in cinlerden olduğu,  '… İblis cinlerdendi, rabbinin emrinden dışarı çıktı' (Kehf sûresi, 18/50.) ayetiyle belirtilir.  Ayrıca, İblis'in diğer cinler gibi ateşten yaratıldığı da belirtilerek (A'raf sûresi, 7/12.) cin olduğu vurgulanır.",Factual
İblis'in şeytanlaşmasının sebebi ve bu durumun insanlık için anlamı nedir?,"İblis, meleklerin Âdem'e secde etmesi emredildiğinde kibirlenerek secde etmeyi reddetti ve kâfir oldu (Bakara sûresi, 2/34.).  Yaratılışı cebri olsa da şeytanlaşması kendi irade ve hatasıyla oldu.  İnsanların manevi yükselişi ve kemali için bir vesile olarak yaratıldı; insanlardaki birçok duygunun gelişimi şeytanla mücadeleye bağlı.  Meleklerin şeytana maruz kalmaması nedeniyle manevi bir yükseliş yaşamaları söz konusu değil; şeytan, insanın manevi gelişimine, atmacanın serçenin uçuş yeteneğini geliştirdiği gibi, istenmeden de olsa katkı sağlar.",Conceptual
Bu metinde şeytanın yaratılış amacı hakkında ne söylenmektedir?,"Metin, şeytanın yaratılış amacı hakkında doğrudan bir açıklama sunmamaktadır. Ancak, hem inananların hem de inanmayanların şeytanın varlığına itiraz etme hakkının olmadığını belirtir. İnanmayanlar için, inanmadıkları şeyleri itiraz konusu olarak kullanmalarının haklı bir yanı yoktur; inananlar için ise, Allah'ın takdirlerine teslimiyet söz konusudur.",Conceptual
"Metne göre, insî ve cinnî şeytanlar arasındaki temel fark nedir?","Metne göre, insî şeytanlar insanları Allah'tan ve O'nun koyduğu esaslardan uzaklaştırmayı yüz yüze yaparken, cinnî şeytanlar bu vesvese ve telkinlerini insanların onları göremeyeceği bir yerden yaparlar.",Factual
Bu metnin ana fikri nedir?,"Metnin ana fikri, şeytanın insanları saptırmak için kullandığı yöntemleri ve bu yöntemlerin Kur'an'daki karşılığını açıklamasıdır. Şeytanın insanları dört yönden (önden, arkadan, sağdan ve soldan) kuşatarak saptırmaya çalıştığı ve insanları dünyaya bağlayarak ahiret inançlarını zayıflattığı anlatılmaktadır.",Summarizing
Şeytanın insanları saptırmak için kullandığı dört yönlü stratejiyi açıklayınız.,"Metne göre şeytan, insanları saptırmak için dört yönden yaklaşır:

1. Önden: Ahiretle ilgili meselelerde şüphe ve tereddüt oluşturarak insanları ahiret hayatına inançsızlaştırır.
2. Arkadan: Dünyanın sürekli ve devamlı olduğunu telkin ederek, dünya nimetlerine odaklanmalarını sağlar ve ahiret düşüncesini unutturur.
3. Soldan: Bâtılı teşvik ederek, günah ve kötülükleri süsleyerek insanları günaha teşvik eder.
4. Sağdan: (Metinde açıkça belirtilmese de, metnin devamında sağdan geleceğiyle ilgili bir açıklama beklenirdi.)",Listing
