question,answer,question_type
Namazın terk edilmesinin kişi üzerindeki riskini nasıl açıklayabiliriz?,"Namaz kılınmadığı zaman, kişi kendini günahlara karşı risk altında bulur.",Conceptual
"Metne göre, huzurlu bir namaz kılmak için hangi şartlar gereklidir?","Huzurlu bir namaz için kalp huzuru, namazın anlamını kavrama (tefehhüm), Allah'a güven ve ümit (recâ) ve Allah'ın huzurunda utanma ve sıkılma duygusu gerekir.",Listing
"Metinde camilerin sadece ibadet yeri olarak değil, aynı zamanda sosyal ve siyasi bir merkez olarak nasıl işlev gördüğüne dair örnekler veriniz.","Metin, camilerin Medine'deki inşaatından sonra Müslümanların planlarını, projelerini, sosyal ve uluslararası ilişkilerini görüştükleri, istişare ettikleri ve karar aldıkları bir merkez olduğunu belirtiyor. Ayrıca, ilmi faaliyetlerin ve halkaların merkezi olarak yükseldiğini ve İslâm medeniyetinin ilk çekirdeklerinin burada atıldığını vurguluyor. Camilerin etrafında ilk şehirlerin örgütlendiğinden de bahsediyor.",Factual
"Metne göre, İslâm ibadet sisteminin toplumsal eşitliği sağlamada nasıl bir rolü vardır ve bu, Batı tarihiyle nasıl karşılaştırılabilir?","Metne göre, İslâm ibadet sistemi, farklı toplumsal statü gruplarını ve sınıfsal yapıları refüze ederek, mahviyet ve tevazu etrafında eşitleyen bir sosyal model oluşturur. Fakir-zengin, efendi-köle gibi farklılıkları ortadan kaldırarak eşit bir statüye kavuşturur. Bu durum, Batı tarihindeki sınıf çatışmaları ve bunun sonucu oluşan kanlı olaylar, siyasi, kültürel ve etnik gettolarla karşılaştırılıyor. İslâm tarihinde ise böyle bir çatışmadan ve farklılaşmadan söz edilemiyor, bunun sebebi ise cemaat halinde kılınan namazların bireylere kazandırdığı kardeşlik ve eşitlik ruhudur.",Analytical
Bu metinde namaz nasıl tanımlanmaktadır ve bu tanımın önemi nedir?,"Metin namazı, insanı gerçek insanlığa ulaştıran nurlu bir yol (helezon) ve müminin miracı (yükselişi) olarak tanımlar. Bu tanımın önemi, namazın sadece bir ibadet değil, aynı zamanda manevi bir yükseliş ve insanın kendini geliştirmesi için bir araç olduğunu vurgulamasıdır.",Factual
Metnin yazarının amacı nedir ve bunu nasıl gerçekleştirmeye çalışmaktadır?,"Yazarın amacı, namazın hakikatini, bir Müslüman'ın hayatındaki yerini ve önemini, namaz öncesi konsantrasyonu ve nasıl bir mirac olduğunu açıklayarak okuyucuların namazı daha iyi anlamalarını sağlamaktır. Bunu, Muhterem Fethullah Gülen'in 'Namaz' yazısını okuyucuya sunarak gerçekleştirmeye çalışmaktadır.",Conceptual
"Namazın mümine göre önemini, metindeki ifadelerle açıklayınız.","Metne göre namaz, müminin miracıdır, mirac yolunda bir ışık ve yolculuğudur. İnanmış gönüllerin sığınağı, kurbet ve vuslat yolcusunun en yakın karargahıdır. Kıyamet günü, namaz kılanlar, temiz elleri, yüzleri ve vicdanlarıyla öne geçeceklerdir.  Ayrıca, Allah'a yakınlığın bir ünvanı olarak kabul edilir ve 'ribat' olarak adlandırılır, ki bu da ömrünü Hakk karşısında geçirmek anlamına gelir.",Conceptual
"Metinde anlatılan namazın, insanın kendini arındırma ve manevi yükselişine nasıl katkıda bulunduğunu açıklayınız.","Metin, namazı günde beş defa kendimizi içine salıp yıkandığımız bir çay olarak tanımlar. Her namaz, bizi hatalarımızdan arındırır, ummana taşır ve sürekli başlangıçla son arasında dolaştırır. Bu durum, uhrevîleşme ve ebedîleşme temrinatı olarak nitelendirilir.  Namaz sayesinde gece-gündüz hayatımız ibadet ekseni etrafında şekillenir, davranışlarımız Hakk'ın gözetimi altında olur ve ibadet dışı hareketlerimiz bile ibadet rengini alır.",Analytical
Ezanın insan üzerindeki etkisi metinde nasıl tasvir ediliyor?,"Metin, ezanın insan üzerindeki etkisini, bedensel ve ruhsal bir deneyim olarak tasvir ediyor.  Dünyevî gürültülerden uzaklaşma, ruhsal bir hazırlık süreci, metafizik bir gerilim ve konsantrasyon hali, göklere yükseliyor hissi gibi imgelerle ezanın dinleyende yarattığı derin etki anlatılıyor.  Ezan, bir müzik banyosu, bir sihirli helezon, bir balon yolculuğu gibi metaforlarla ifade edilerek duyusal ve ruhsal bir deneyim olarak vurgulanıyor.",Analytical
Metinde bahsedilen 'dünya-ukbâ arası bir berzah' ifadesinin anlamı nedir ve ezanla nasıl ilişkilidir?,"'Dünya-ukbâ arası bir berzah' ifadesi, ezan okunurken yaşanan, dünya ile ahiret arasında bir ara durum, bir geçiş anını ifade ediyor.  Ezanın okunmasıyla birlikte, dünyevî gürültülerden uzaklaşılıp, ruhsal bir hazırlık ve konsantrasyon evresine geçilmesi, bu 'berzah' deneyimini oluşturuyor.  İnsanlar, ezan sayesinde dünyanın telaşından sıyrılıp, ruhsal bir yolculuğa başlıyorlar.",Conceptual
