question,answer,question_type
İhlâs kelimesinin sözlük anlamı nedir ve İhlâs Suresi'nin yorumu bağlamında nasıl anlaşılmaktadır?,"İhlâs kelimesi, sözlük anlamı olarak bir şeye halis, katıksız bir şekilde muhatap olmayı ifade eder.  İhlâs Suresi yorumunda ise, insanın kulluğunda ve ibadetinde Allah'ın emir, istek ve ihsanları dışında her şeye karşı kapanması, görevlerini Allah'ın emri olduğu için yerine getirmesi ve bu sırada Allah'ın rızasını hedeflemesi anlamında kullanılır.",Factual
"İhlâs'ın zıddı olan şirk, İhlâs Suresi'nin mesajı açısından nasıl değerlendirilmektedir?","İhlâs'ın zıddı olan şirk, ulûhiyet ve rubûbiyet sıfatlarını sadece Allah'a değil, başkalarına da atfetmeyi içerir. Bu, saf imanı bulanıklaştırır ve yalnızca Allah'ın rızasını değil, riya, menfaat gibi görüntüler altında başkalarının rızasını aramaya yol açar. Şirk, iman etmiş bir insan için en tehlikeli durum olarak gösterilir ve küfre, isyana ve inkâra uzanan yolculukların başlangıç noktası olarak tanımlanır. İhlâs Suresi, zahiren ihlâstan bahsetmese de, ihlâsın reçetesini sunarak şirkin tehlikesine karşı uyarır.",Analytical
Bu metnin ana fikri nedir?,"Metnin ana fikri, Allah'ın Ehad isminin, Vâhid ismine göre daha kapsamlı bir anlam taşıdığı ve ihlâsa ulaşmak için her şeye Allah'ın birliği ve tekliği bilinciyle bakmanın gerekliliğidir.  'Her şeyi yaratan Allah'tır' bilgisinin yeterli olmadığı, her şeyin Allah'ın doğrudan kontrolü altında olduğu gerçeğinin kabul edilmesi gerektiği vurgulanmaktadır.",Summarizing
Ehad ve Vâhid isimleri arasındaki ince nüansı açıklayınız.,"Metne göre, Vâhid ismi her şeyi yaratanın Allah olduğunu ifade ederken, Ehad ismi her bir şeyi onda gözüken tüm özelliklerle birlikte yaratanın O olduğuna işaret etmektedir.  Vâhid daha genel bir ifade iken, Ehad her bir varlığın Allah'ın doğrudan yaratması ve kontrolü altına olduğuna vurgu yapar. Bu fark, şirkten korunmada ve ihlasa ulaşmada önemli bir rol oynar.",Factual
Ayet 2'deki Samed isminin anlamı ve Ehad ismiyle olan ilişkisi nedir?,"Samed ismi, 'Her şey O'na muhtaç ama O hiçbir şeye muhtaç değil' anlamına gelir.  Ehad isminin bir sonucu olarak görülür; çünkü her şeydeki özelliklerin Allah'a ait olduğunu ve O'ndan geldiğini anlayan biri, ister istemez her şeyin O'na muhtaç olduğu sonucuna, yani Samed ismine ulaşır.",Factual
"3. ayette geçen 'lem yelid ve lem yûled' ifadesinin, Allah'ın doğası ve diğer varlıklarla ilişkisine dair ne gibi sonuçları vardır?","'Lem yelid ve lem yûled', Allah'ın doğmamış ve doğurmamış olduğunu belirtir.  Bu, Allah'ın ne başka bir şeyden doğmuş bir varlık ne de diğer varlıkların O'ndan doğmuş olduğu anlamına gelir.  Doğan ve doğuran varlıkların ilah olamayacağı sonucunu çıkarır çünkü doğma ve doğurma, kendinden başkasına muhtaç olmayı gerektirir;  Allah ise mutlak ve hiçbir şeye muhtaç değildir.",Conceptual
Bu metnin ana fikri nedir?,"Bu metin, Allah'ın yaratıcılığı ve sebeplere riayet etmenin önemini vurgular. Allah'ın eşi, benzeri veya dengi olmadığını, her şeyin O'nun eseri olduğunu ve sebeplerin Allah'a bir dua niteliğinde olduğunu açıklar. Sebeplere gerçek anlamda etki atfetmenin şirk olduğunu, sebeplere etki atfetmemenin ise tevhide yol açtığını belirtir.",Summarizing
Metinde bahsedilen 'lem yelid ve lem yûled' ifadesinin anlamı ve önemi nedir?,"'Lem yelid ve lem yûled', 'doğmamış ve doğurmamış' anlamına gelir. Metinde, bu ifade doğan ve doğuran bütün sebepleri, sonuç üzerinde 'hakikî tesir ve sahiplenme' iddiasından azletmekte ve her şeyin -sebebi ve sonucuyla birlikte- doğrudan doğruya Allah'ın eseri ve mülkünden ibaret olduğunu bilmeyi gerekli kılmaktadır.  Yani, yaratılışta Allah'ın tek ve mutlak gücünü vurgular.",Conceptual
"Bu ayetin, insanın yaratılıştaki yerini anlamada nasıl bir rolü vardır?","Ayet, insanı, yaratıcısı olan Allah'a karşı sorumluluklarını hatırlatarak, yaratılan (mahlûk) ve yaratan (hâlık) arasındaki dengeyi doğru kurmaya çağırır. Bu dengeyi kurabilen insan, diğer yaratıklara karşı doğru bir tavır sergiler ve Allah'ın tek yaratıcı ve sahip olduğunu kabul eder.",Conceptual
Ayette bahsedilen 'tevhid' ve 'ihlas' kavramları ne anlama gelir ve bunlara nasıl ulaşabiliriz?,"Tevhid, Allah'ın birliğini ve tekliğini kabul etmek anlamına gelirken, ihlas ise Allah'a olan ibadetin sadece O'nun rızasını kazanmak amacıyla yapılmasıdır.  Ayette belirtildiği gibi,  hâlıkıyet, kudret, rubûbiyet ve mâlikiyet sıfatlarını yalnızca Allah'a atfetmek ve sadece O'na kul olmak suretiyle tevhide ve ihlasa ulaşabiliriz.",Conceptual
