question,answer,question_type
İmamın terk ettiği durumlarda cemaat ne yapar ve bu durumlar nelerdir?,"İmam selâmı terk ederse veya teşrik tekbirini getirmezse cemaat bunları yapar. İmam kunut duasını, bayram tekbirlerini, birinci oturuşu, tilavet secdesini, sehiv secdesini terk ederse cemaat de terk eder.  İmam bir secde fazla yaparsa, bayram tekbirlerini rivayet edilen mikdardan fazla yaparsa, cenaze namazında dörtten fazla tekbir getirirse veya yanılarak beşinci rekata kalkarsa cemaat imama uymaz.",Factual
Beşinci rekata kalkıldığında imamın hareketlerine göre cemaatin durumu nasıldır ve namazın geçerliliği nasıl etkilenir?,"Eğer imam dördüncü rekattan sonra oturmuşsa ve hemen selâm verirse cemaat de selâm verir. Ancak imam beşinci rekata secdeye varırsa cemaat kendi başına selâm verip namazdan çıkar. Eğer imam dördüncü rekattan sonra oturmamışsa ve hemen kıyamdan ka'deye dönüp selâm verirse cemaat de onunla beraber selâm verir. Fakat imam beşinci rekâtı secde ile bağlarsa, hepsinin namazı bozulmuş olur. Bu durumda cemaatin yalnız başına teşehhüdü yapıp selâm vermesi fayda vermez.",Analytical
"Bir kimse, imam rükû halindeyken namaza katılmak isterse ve ilk saflara gitmesi rekât kaçırma riskini doğurursa ne yapmalıdır?","Eğer ilk saflara geçmek rekât kaçırma riskini doğurursa, son safa geçerek imama uyar veya saflardan birine katılmaksızın tek başına bir yerde durarak imama uyar. Rekat kaçırma ihtimali olsa bile bu geçerlidir.",Procedural
Namaz kılanın önünden geçmek ne zaman mekruhtur ve ne zaman mekruh olmaz?,"Namaz kılanın önünden geçmek, önünde perde, ağaç, direk gibi bir engel yoksa mekruhtur.  Büyük ve açık alanlarda (kırlarda, büyük mescitlerde) namaz kılanın önünden geçmek zor olsa da mekruhtur.  Evlerde ve küçük mescitlerde ise mekruhtur.",Factual
Hanefi mezhebine göre Şafii bir imama uyup namaz kılmak caiz midir?,"Evet, Hanefi mezhebinde olan bir kişi Şafii mezhebindeki bir imama uyup namaz kılabilir. Mezhep farklılığı namazın edasına engel değildir, yeter ki imam namazın şartlarına ve rükünlerine riayet etsin.",Factual
Farklı mezheplerden insanların bir arada namaz kıldığı durumlarda imamlık yapacak kişilerin nelere dikkat etmesi gerekir?,"Değişik mezhepteki insanların olduğu bir yerde imamlık yapacak kişilerin diğer mezheplerin ihtilaf noktalarına da riayet etmeleri gerekir.  Örneğin, Hanefi mezhebine göre kan akması abdesti bozarken, Şafii mezhebine göre belli bir miktara ulaşmadıkça abdesti bozmaz. Bu nedenle, imamların farklı mezheplerin bu tür ihtilaflarını da göz önünde bulundurmaları önemlidir.",Procedural
Namazın tanımı ve önemi nedir?,"Namaz, Kelime-i şehadetten sonra İslam'ın en önemli ibadetidir. Günde beş vakit kılınması kadın ve erkek tüm Müslümanlar için farzdır. Kur'an'da, Hz. Muhammed'den önceki peygamberlerin de namaz kıldıkları belirtilmekte olup, bu ibadetin sadece İslam'a özgü olmadığını gösterir.  Namaz, Allah'ı sürekli hatırlamanın bir vesilesi olup, zorluklara karşı direnç göstermede de önemli bir fonksiyona sahiptir (Bakara 2/153).  Miraç gecesi Allah'ın bizzat Peygamber Efendimize tebliğ etmesi, namazın dini ve ruhani hayattaki önemini vurgular.  'Namaz müminin miracıdır' sözü, namazın kulun Allah'a ulaşmasında önemli bir araç olduğunu özetler.",Factual
Namazın önceki dinlerde de emredilmiş olmasının önemi nedir?,"Namazın önceki dinlerde de emredilmiş olması, namazın sayısız hikmetinin yanında, zorluklara karşı direnç gösterme fonksiyonuna sahip olduğunu gösterir. Bu durum, namazın sadece İslam'a özgü bir ibadet olmadığını, aynı zamanda insanlık tarihi boyunca devam eden ve önemini koruyan bir ibadet olduğunu vurgular.",Conceptual
Namazın hayatımızı nasıl disipline ettiğini açıklar mısınız?,"Günde beş vakit kılınan namaz, mümini hem ruhen hem bedenen, hem maddeten hem manen belli bir disipline alıştırır. Özellikle cemaatle kılınan namazlarda imama uymak, askeri bir disipline benzer bir düzen getirir. İmamın tekbirleri, cemaati oturtur ve kaldırır; bu da manevi bir disiplin oluşturur. Bu disiplin, ruhsal, zihinsel ve manevi bir disiplindir ve diğer disiplinlerde bulunmayan sıcak bir duyguyu da beraberinde getirir.",Conceptual
Kur'an'da namazın hangi olumsuz davranışlardan koruduğu belirtilmektedir?,"Kur'an'da (Ankebut, 29/45), namazın hayasızlıktan ve kötülükten alıkoyduğu belirtilmektedir. Namaz, Allah'a yakınlık olduğu için insanı her türlü günahtan korur; ancak bu koruma, namazın şuurlu ve anlamlı bir şekilde kılınması durumunda geçerlidir. Maun suresi ise namazı gafletle kılanları uyarır.",Factual
