question,answer,question_type
Sabah namazının vakti ne zaman başlar ve ne zaman sona erer?,"Sabah namazının vakti, fecr-i sadık denilen ikinci fecrin doğmasından güneşin doğmasına kadar olan süreyi kapsar. Fecr-i sadık, sabaha karşı doğu ufkunda görünen ve genişleyerek yayılan bir aydınlıktır. Bu vakit aynı zamanda sahurun sona erip orucun başlaması (imsak) vaktidir.",Factual
"Metne göre, öğle namazının vaktinin başlangıcı ve bitişiyle ilgili olarak, güneşin konumu ve gölge uzunluğu nasıl bir ilişki içerisindedir?","Öğle namazının vakti, güneşin tepe noktasını geçip batıya doğru kaymasından itibaren başlar.  Güneş tam tepedeyken eşyanın yere düşen gölge uzunluğu hariç, her şeyin gölgesi kendisinin iki misline ulaşacağı zamana kadar devam eder. Yani güneşin batıya doğru hareketi ve gölge uzunluğunun artması öğle namazı vaktini belirler.",Analytical
Bu metinde öğle namazının kılınmasının ruhsal faydaları nelerdir?,"Metne göre, öğle namazı kılmak, kişinin sıkıntılarından kurtulmasına, Rabbine şükretmesine ve dünya işlerinden geçici olarak sıyrılıp bir nefes almasına olanak tanır.  Ruh için bir teneffüs gibidir; kişi ruhunu dinler ve kalbinin atışlarına kulak verirse, dersten bunalan talebenin teneffüse kavuşma heyecanını hisseder. Ayrıca, öğlenin şiddetli hararetinde mescide koşmak, Allah'a yaklaşmak ve O'nun gölgesine sığınmak anlamına gelir.  Bu, huzur ve saadet getirir.",Conceptual
İkindi namazının vakti ne zaman başlar ve ne zaman biter? Bu vaktin insan hayatı ile olan bağlantısı nedir?,"İkindi namazının vakti, öğle namazının vaktinin çıkmasından güneşin batmasına kadardır. Metin, ikindi vaktinin, güneşin batmaya başladığı, insanlığın ihtiyarladığı ve her şeyin sona erdiğinin bir hatırlatıcısı olduğunu belirtir.  Bu vakit, her şeyin yok olmaya doğru gittiğini ve insanın da fani olduğunu anlamamızı sağlar.  Ümitsizliğe düşeceğimiz bir anda ezan sesi duymak ve namaza koşmak ise, fani hayatı bâkileştirme yolunu bulduğumuz için sevinç ve neşe demektir.",Factual
İmam Azam'a göre ve diğer üç imama göre şafak nasıl tanımlanır?,"Üç imama ve İmam Azam'ın diğer bir rivayetine göre şafak, ufukta oluşan kızıllıktır. Bu kızıllık kaybolduğunda akşam namazının vakti girmiş olur.",Factual
Akşam namazının vaktinin dar olması neden önemlidir ve bu durum namazın kılınışıyla nasıl ilişkilendirilir?,"Akşam namazının vakti dardır, bu yüzden geciktirmek uygun değildir. Kızartının kaybolmasına kadar geciktirmemek gerekir çünkü akşam namazını ilk vaktinde kılmak müstehaptır.",Conceptual
Yatsı namazı vakti ne zaman başlar ve ne zaman sona erer?,"Yatsı namazının vakti, güneşin batışından sonra gökte oluşan kızıllığın veya bu kızıllığı takip eden beyazlığın kaybolmasından (akşam namazı vaktinin çıkmasından) itibaren başlar ve ikinci fecrin doğmasına kadar devam eder.",Factual
"Metne göre, yatsı vakti insanın hayatında hangi duyguyu ve düşünceyi uyandırmayı amaçlar?","Yatsı vakti, her şeyin bitişiyle birlikte insan ömrünün de bitip kaybolmasını hatırlatır; insanın kabirde her türlü ışık ve ziyadan mahrum kalacağı bir ânı hatırlatarak, böylesine gönlü kırık, hissi yıkık ve bütün duyguları alt üst olmuş bir kulun, teselli ve dilek için Rabbine yönelmesini amaçlar.",Conceptual
Bu metnin ana teması nedir?,"Metnin ana teması, gece karanlığının ve kabrin dehşetinin insan üzerindeki etkisi ve bu korkulara karşı gece namazının (teheccüd) önemi ve tesirliliğidir.  Gece namazının, insanın maneviyatını güçlendirmesi ve Allah'a yakınlaşması için bir fırsat olduğu vurgulanmaktadır.",Summarizing
Ayete göre gece namazı kılmanın önemi ve faydaları nelerdir?,"Ayete göre gece namazı daha tesirlidir ve Kur'an okumak için daha uygun bir zamandır.  Gündüzün iş yoğunluğu göz önüne alındığında, gece ibadetinin Allah'a müracaat için daha uygun bir zaman olduğu belirtilmektedir.  Metin ayrıca, gece namazının insanın hayatını nurlandırması ve karanlık gecesini aydınlatması gibi manevi faydalarından bahsetmektedir.",Factual
