question,answer,question_type
Cuma namazının diğer namazlardan farkı nedir?,"Cuma namazı, kıyam, kıraat, rükû, sücud ve ka'deden ibaret olmasıyla diğer namazlardan farklı değildir.",Factual
Peygamber Efendimiz (s.a.v.)'in Cuma günü hakkında söylediği hadiste hangi önemli noktalar vurgulanmaktadır?,"Hadiste Cuma gününün diğer günlere göre üstünlüğü, Allah'ın Âdem'i yaratması, yeryüzüne indirmesi ve ruhunu kabzetmesi gibi önemli olayların bu güne denk gelmesi, özel bir saatte yapılan duaların kabul edilmesi ve kıyametin bu günde kopacağı belirtilmektedir.",Conceptual
"Kur'an'ın Cuma Suresi'nde, müminleri cuma namazına davet eden ayet hangi mesajı vermektedir?","Kur'an'ın Cuma Suresi'nde (62/10), müminler cuma namazına çağrıldıklarında Allah'ı anmaya koşmaları ve alışverişlerini bırakmaları emredilmektedir. Bu ayeti kerime, cuma namazının önemini ve Allah'ı anmanın hayırlılığını vurgulamaktadır.",Factual
Hz. Osman döneminde ezan uygulamasında nasıl bir değişiklik yapılmış ve bunun nedeni neydi?,"Müslümanlar çoğalıp şehirler büyüdükçe, minareden okunan ezan her yere ulaşamaz olmuştur. Bu nedenle Hz. Osman, hatibin minberde okumasına ek olarak, halka duyurmak için dışarıda da ezan okutulmasını başlatmıştır. Bu uygulama, icma ile kabul görmüştür.",Historical
Cuma namazının ferdî bir ibadet olmadığını nasıl açıklayabiliriz?,"Cuma namazı, metne göre ferdî bir ibadet değil, toplu bir ibadettir; ma'şerî vicdanın Yüce Allah'a teveccühüdür.  Tek başına yapılan ibadetin, Allah'ın nimetlerine karşı şükrü tam olarak ifade edemeyeceği, cemaatle yapılan ibadetin bu eksikliği gidereceği belirtilmektedir.",Conceptual
"Metinde geçen, 'Rabbim! Allah'ın nimetlerini saymaya kalkışsanız...' ayeti (İbrahim, 14/34) neyi vurgulamaktadır?","Bu ayet, Allah'ın nimetlerinin sayılamayacak kadar çok olduğunu ve bireysel olarak bu nimetlere karşı şükürde yetersiz kalınabileceğini vurgulamaktadır. Bu nedenle cemaatle ibadetin önemi vurgulanmaktadır.",Contextual
Peygamber Efendimiz (s.a.v.) Mekke'de Cuma namazı kılmakla mükellef müydü?,"Hayır, Peygamber Efendimiz (s.a.v.) Mekke'de Cuma namazı kılmakla mükellef değildi. Bu mükellefiyet, Medine'ye hicret ettikten sonra başlamıştır.",Factual
Kuba Mescidi'nin inşası ve ilk Cuma namazının kılınması arasında nasıl bir ilişki vardır?,"Peygamber Efendimiz (s.a.v.) Medine'ye hicret ettikten sonra önce Kuba'da mescit inşa ettirmiş ve orada birkaç gün kaldıktan sonra, Cibril'in haber vermesi üzerine Salim İbn-i Avf oğullarının vadisinde ilk Cuma namazını kıldı. Yani Kuba Mescidi'nin inşası, ilk Cuma namazının kılınmasına zemin hazırlamıştır.",Contextual
"Cuma namazının önemini, metindeki benzetmelere dayanarak açıklayınız.","Metin, Cuma namazını 'sefine-i dinin direği' ve mümine yol gösteren 'pusula' olarak tanımlıyor. Ayrıca, mümini yüceltecek bir 'merdiven' ve Allah'a bağlayan 'sağlam bir ip' (hablü'l-metin) olarak nitelendiriyor. Bu benzetmeler, Cuma namazının dinin temel direği olduğunu, müslümanı doğru yola yönlendirdiğini ve Allah'a yakınlaştırdığını vurguluyor.",Conceptual
"Metne göre, Cuma namazı sırasında Allah'tan bir şey isteyen müslümanın duası kabul edilir mi? Bu konudaki hadisi ve farklı yorumları açıklayınız.","Evet, metne göre Peygamber Efendimiz (s.a.v.) Cuma namazında belirli bir saatte yapılan duaların kabul edileceğini söylemiştir. Ancak, bu saatin tam olarak ne zaman olduğu konusunda farklı görüşler vardır. Sahabe, Tabiin ve alimler bu konuda değişik zamanlar belirtmişlerdir. Abdullah İbni Selam'ın rivayetine göre Peygamber Efendimiz, bu saatin günün sonlarına doğru olduğunu, hatta namazdan sonra beklemenin bile sevap olacağını ifade etmiştir.  Ancak, bu özel anın Cuma gününün tamamında dolaştığı ve Allah'a tam bir teveccüh ile yönelmeye bağlı olduğu da belirtilmiştir.",Factual
