question,answer,question_type
Uyku ve ölümün benzerliğine dair Kuran'da hangi örnek verilir ve bu örnek yeniden diriliş inancıyla nasıl ilişkilendirilir?,"Kuran, ardı ardına gelen uyku ve uyanıklık hallerini ölümden sonra da hayat olacağına dair bir örnek olarak sunar.  Geceleyin uyutulup gündüz diriltilmemiz, ölüm ve yeniden dirilişin bir benzeri olarak gösterilir.  Bu, yeniden dirilişin mümkün olduğuna dair güçlü bir kanıt olarak sunulur.",Conceptual
"Elmalılı Hamdi Yazır'ın, Kuran'daki ""Sonra (gündüzün yine) sizi diriltir"" ayetiyle ilgili yorumu özet olarak nedir?","Yazır, ayetteki dirilişi, Allah'ın uyku sırasında bedenimizi tamir edip, şuur ve idrakimizi geri vererek bizi yeniden hayata döndürmesi olarak yorumlar.  Bu günlük, ruhani ve cismani bir diriliştir ve gerçek bir 'ba's'tır, mecazi değil.",Factual
Bu metnin ana fikri nedir?,"Metnin ana fikri, Kuran'da ölüm ve uyku arasında yapılan benzerlik üzerinden dirilişin mümkün olduğunu göstermeye çalışmaktır. Uyku, küçük bir ölüm, ölüm ise büyük bir uyku olarak tanımlanarak, her iki durumda da ruhun bir hayattan diğerine geçişi vurgulanmaktadır.  Geçmişte yaşanmış mucizevi diriliş olaylarına da değinilerek Allah'ın ölülere hayat verme gücüne sahip olduğu gösterilmeye çalışılmaktadır.",Summarizing
Metinde uyku ve ölümün benzerliğine dair verilen hadis örneği nedir?,"Metinde, uykuya dalarken ""Allah'ım, Senin isminle ölüyor ve diriliyorum!"" ve uyanırken ""Bizi ölümümüzden sonra dirilten Allah'a hamd olsun!"" şeklinde dua etmenin tavsiye edildiği bir hadis örneği verilmiştir (Buharî, Tevhid 13).",Factual
Bu metnin ana fikri nedir?,"Bu metin, Kur'ân'ın diriliş gerçeğini desteklemek için geçmişte yaşanmış diriliş örneklerini nasıl sunduğunu açıklıyor ve bu örneklerin dirilişin hem mümkün olduğunu hem de cismanî olacağını gösterdiğini vurguluyor.",Summarizing
Metinde bahsi geçen diriliş örneklerinden üç tanesini listeleyebilir misiniz?,"Metinde bahsi geçen diriliş örneklerinden üçü şunlardır: Ashab-ı Kehf'in üç yüz dokuz sene sonra diriltilmesi, İsrailoğullarından birinin sığır organıyla vurularak diriltilmesi ve Sina çölünde bir topluluğun topluca öldürülüp diriltilmesi.",Listing
Bu metnin ana fikri nedir?,"Bu metin, Kur'an'ın ahiret hayatının gerekliliğini, özellikle de salih amellerin karşılığının verilmesi bağlamında, nasıl açıkladığını ele almaktadır.  Ahiret hayatının varlığı, iyilik ve kötülük arasındaki mücadelede anlam ve adaletin sağlanması için gerekli görülmektedir.",Summarizing
"Metinde, ahiret hayatının gerekliliğinin hangi sebebe bağlandığı açıklanmaktadır?  Bu sebebin önemi nedir?","Metin, ahiret hayatının gerekliliğini, 'ubudiyetin/kulluğun karşılığının verilmesi' sebebine bağlamaktadır.  Bu sebebin önemi, Allah'ın salih kullarının amellerini karşılıksız bırakmasının O'nun hikmetine aykırı olacağı ve iyilik ile kötülük arasında farkın ortadan kalkacağı düşüncesine dayanmaktadır.  Adaletin sağlanması ve insanların iyilik için verdikleri çabaların anlamlı olması için ahiret hayatı gereklidir.",Factual
Bu metnin ana teması nedir?,"Bu metin, ahiret hayatının varlığının ve mutlak adaletin gerçekleşmesinin önemini vurguluyor. Ahiret hayatının, dünyada eksik kalan adaletin tamamlanması, ibadetlerin karşılığının alınması ve yaratılış gayelerinin gerçekleşmesi için gerekli olduğuna işaret ediyor.",Summarizing
Metinde bahsedilen 'vicdanî ıstırap ve vicdanî tatmin'in ahiret hayatı düşüncesiyle olan ilişkisi nedir?,"Metin, vicdanî ıstırap ve tatminin insan için yeterli olup olmadığı ve bunun ahiret hayatına duyulan ihtiyacı ortadan kaldırabileceği iddiasının tutarsızlığını tartışıyor. Suçsuz bir insanı öldüren ve hemen sonra ölen bir kişinin suçundan dolayı ıstırap çekme fırsatı bulamayacağını veya hak ve adalet için savaşırken ölen bir kişinin kalbindeki itminan mükâfatını ne zaman yaşayacağını sorgulayarak bu yaklaşımın yetersizliğini vurguluyor.",Analytical
